<?xml version="1.0" encoding="UTF-8"?>
<!DOCTYPE schemaExchange SYSTEM "dtdForSchemaExchange.dtd">
<schemaExchange name="U4-denormalizzazione con 1+2 costanti">
	<source>
		<relation name="r1">
			<key name="k1"/>
			<attribute name="a1" constant="course"/>
			<attribute name="a2"/>
			<fkey name="fk1">
				<refRelName>r3</refRelName>
			</fkey>
		</relation>
		<relation name="r3">
			<key name="k3"/>
			<attribute name="a3" constant="name"/>
			<attribute name="a4" constant="rating"/>			
			<attribute name="a5"/>
		</relation>
	</source>
	<target>
		<relation name="r1">
			<key name="k1"/>
			<attribute name="a1"/>
			<attribute name="a4"/>
			<attribute name="a3"/>
		</relation>
	</target>
</schemaExchange>
