<?xml version="1.0" encoding="UTF-8"?>
<!DOCTYPE schemaExchange SYSTEM "dtdForSchemaExchange.dtd">
<schemaExchange name="G-4copia semplice, generazione  attributo">
	<source>
		<relation name="r3">
			<key name="k3"/>
			<attribute name="a5"/>
		</relation>

	</source>
	<target>
		<relation name="r3">
			<key name="k3"/>
			<attribute name="a6"/>
		</relation>
	</target>
</schemaExchange>
