<?xml version="1.0" encoding="UTF-8"?>
<!DOCTYPE schemaExchange SYSTEM "dtdForSchemaExchange.dtd">
<schemaExchange name="C1-company CMS esterno con FK">
	<source>
		<relation name="r1"> 010200aa
			<key name="k1"/>
			<attribute name="a1" constant="title"/>
			<fkey name="fk1">
				<refRelName>r2</refRelName>
			</fkey>
			<fkey name="fk2">
				<refRelName>r3</refRelName>
			</fkey>
		</relation> 010001aa
		<relation name="r2">
			<key name="k2"/>
			<attribute name="a2" constant="officePhone" />
		</relation>
		<relation name="r3"> 010001aaa
			<key name="k3"/>
			<attribute name="a31" constant="file" />
			<attribute name="a32" />
		</relation>
	</source>
	<target>
		<relation name="r1">
			<key name="k1"/>
			<attribute name="a1"/>
			<attribute name="a2"/>
			<attribute name="a3"/>
		</relation>
	</target>
</schemaExchange>
