<?xml version="1.0" encoding="UTF-8"?>
<!DOCTYPE schemaExchange SYSTEM "dtdForSchemaExchange.dtd">
<schemaExchange name="C3-company CMS esterno solo title">
	<source>
		<relation name="r1">
			<key name="k1"/>
			<attribute name="a1" constant="title"/>
		</relation>
		
		
	</source>
	<target>
		<relation name="r1">
			<key name="k1"/>
			<attribute name="a1"/>

		</relation>
	</target>
</schemaExchange>
