<?xml version="1.0" encoding="UTF-8"?>
<!DOCTYPE schemaExchange SYSTEM "dtdForSchemaExchange.dtd">
<schemaExchange name="G1-denormalizzazione catena di join">
	<source>
		<relation name="r1">
			<key name="k1"/>
			<attribute name="a1"/>
			<fkey name="fk1">
				<refRelName>r2</refRelName>
			</fkey>
		</relation>
		<relation name="r2">
			<key name="k2"/>
			<attribute name="a3"/>			
			<fkey name="fk2">
				<refRelName>r3</refRelName>
			</fkey>		
		</relation>
		<relation name="r3">
			<key name="k3"/>
			<attribute name="a5"/>
		</relation>

	</source>
	<target>
		<relation name="r1">
			<key name="k1"/>
			<attribute name="a1"/>
			<attribute name="a3"/>
			<attribute name="a5"/>
		</relation>
	</target>
</schemaExchange>
