<?xml version="1.0" encoding="UTF-8"?>
<!DOCTYPE schemaExchange SYSTEM "dtdForSchemaExchange.dtd">
<schemaExchange name="t6 - denormalizzazione con costanti">
	<source>
		<relation name="r1">
			<key name="k1"/>
			<attribute name="a1" constant="title"/>
			<fkey name="fk1">
				<refRelName>r2</refRelName>
			</fkey>
		</relation>
		<relation name="r2">
			<key name="k2"/>
			<attribute name="a2" constant="name"/>
		</relation>
		<relation name="r3">
			<key name="k3"/>
			<attribute name="a3" constant="office"/>
			<fkey name="fk2">
				<refRelName>r1</refRelName>
			</fkey>
		</relation>
	</source>
	<target>
		<relation name="r1">
			<key name="k1"/>
			<attribute name="a1"/>
			<attribute name="a2"/>
			<attribute name="a3"/>
		</relation>
	</target>
</schemaExchange>
