<?xml version="1.0" encoding="UTF-8"?>
<!DOCTYPE schemaExchange SYSTEM "dtdForSchemaExchange.dtd">
<schemaExchange name="U7-copia e proiezione con 2+1 costanti">
	<source>
		<relation name="r1">
			<key name="k1"/>
			<attribute name="a1" constant="course"/>
			<attribute name="a2"/>
			<fkey name="fk1" constant="university">
				<refRelName>r3</refRelName>
			</fkey>
		</relation>
		<relation name="r3">
			<key name="k3"/>
			<attribute name="a3" constant="address"/>
			<attribute name="a4"/>
		</relation>
	</source>
	<target>
		<relation name="r1">
			<key name="k1"/>
			<attribute name="a1"/>
			<fkey name="fk1">
				<refRelName>r3</refRelName>
			</fkey>
		</relation>
		<relation name="r3">
			<key name="k3"/>
			<attribute name="a2"/>
			<attribute name="a3"/>
		</relation>
	</target>
</schemaExchange>
