<?xml version="1.0" encoding="UTF-8"?>
<!DOCTYPE schemaExchange SYSTEM "dtdForSchemaExchange.dtd">
<schemaExchange name="C5-company CMS esterno title e file in tabella referenziata">
	<source>
		<relation name="r1">
			<key name="k1"/>
			<attribute name="a1" constant="title"/>
			<attribute name="a2"/>
			<fkey name="fk2">
				<refRelName>r2</refRelName>
			</fkey>
		</relation>

		<relation name="r2">
			<key name="k2"/>
			<attribute name="a3" constant="file"/>
			<attribute name="a4"/>
		</relation>
		
		
	</source>
	<target>
		<relation name="r1">
			<key name="k1"/>
			<attribute name="a1"/>
			<attribute name="a2"/>
			<attribute name="a3"/>
		</relation>
	</target>
</schemaExchange>

